title,link
GCC 4.9 Coming With Big New Features,http://developers.slashdot.org/story/13/11/18/0128226/gcc-49-coming-with-big-new-features?
The Top Languages on GitHub; According to hubReports,http://hubreports.yougeezer.co.uk/languages?utm_source=statuscode&utm_medium=email
MRI Ruby 1.8; 1.9; 2.0 and 2.1 Affected by Heap Overflow in Floating Point Parsing,https://www.ruby-lang.org/en/news/2013/11/22/heap-overflow-in-floating-point-parsing-cve-2013-4164/?utm_source=statuscode&utm_medium=email
Redis 2.8.0 Released,https://groups.google.com/forum/#!msg/redis-db/37xgI268Nh8/GEz0260U5QoJ?utm_source=statuscode&utm_medium=email
Hordes Of Novices,http://blog.8thlight.com/uncle-bob/2013/11/19/HoardsOfNovices.html?utm_source=statuscode&utm_medium=email
An Introduction To Full-Stack JavaScript,http://coding.smashingmagazine.com/2013/11/21/introduction-to-full-stack-javascript/?
PyParallel: How We Removed the GIL and Exploited All Cores [video],https://vimeo.com/79539317?utm_source=statuscode&utm_medium=email
Top 100 Libraries in Java; JS and Ruby (Among 30;000 GitHub Projects),http://www.takipiblog.com/2013/11/20/we-analyzed-30000-github-projects-here-are-the-top-100-libraries-in-java-js-and-ruby/?utm_source=statuscode&utm_medium=email
How Python Became The Language of Choice for Data Science,http://blog.mikiobraun.de/2013/11/how-python-became-the-language-of-choice-for-data-science.html?utm_source=statuscode&utm_medium=email
Building Memory-Efficient Java Applications:  Practices and Challenges [PDF],http://www.cs.virginia.edu/kim/publicity/pldi09tutorials/memory-efficient-java-tutorial.pdf?utm_source=statuscode&utm_medium=email
Today’s Smalltalk: A Second Look At The First OO Language,http://blog.smartbear.com/programming/todays-smalltalk-a-second-look-at-the-first-oo-language/?utm_source=statuscode&utm_medium=email
Oracle Pours Hot; Steaming Java Into Heterogeneous Heaven,http://www.theregister.co.uk/2013/11/13/oracle_to_pour_hot_steaming_java_into_heterogeneous_haven/?
How To Succeed In Open Source (In Ways You Haven't Considered Yet),http://gaslight.co/blog/how-to-succeed-in-open-source-in-ways-you-havent-considered-yet?utm_source=statuscode&utm_medium=email
Introducing Node.js Tools for Visual Studio (NTVS),http://www.hanselman.com/blog/IntroducingNodejsToolsForVisualStudio.aspx?utm_source=statuscode&utm_medium=email
.NET Fiddle: An Online Sandbox for C# and VB.net,http://www.dotnetfiddle.net/?utm_source=statuscode&utm_medium=email
JSFiddle.,http://jsfiddle.net/
ClojureScript Koans,http://clojurescriptkoans.com/?utm_source=statuscode&utm_medium=email
Clumsy: A Utility for Simulating A Broken Network On Windows,http://jagt.github.io/clumsy/?utm_source=statuscode&utm_medium=email
chrome-github-avatars: Display Avatars in Your GitHub News Feed,https://github.com/anasnakawa/chrome-github-avatars?utm_source=statuscode&utm_medium=email
Whoosh: Fast Full-Text Indexing and Searching Library in Pure Python,https://bitbucket.org/mchaput/whoosh/wiki/Home?utm_source=statuscode&utm_medium=email
In-Progress Book Site for "Advanced R Development",http://adv-r.had.co.nz/?utm_source=statuscode&utm_medium=email
R,http://en.wikipedia.org/wiki/R_(programming_language)
Basics of Compiler Design [PDF],http://www.diku.dk/~torbenm/Basics/basics_lulu2.pdf?utm_source=statuscode&utm_medium=email
Hell: A Haskell-based Shell,https://github.com/chrisdone/hell?utm_source=statuscode&utm_medium=email
ELF101: A Linux Executable Walkthrough in Poster Form,https://code.google.com/p/corkami/wiki/ELF101?utm_source=statuscode&utm_medium=email
How Do I Design A Class?,http://stackoverflow.com/questions/4203163/how-do-i-design-a-class-in-python/4203836#4203836?utm_source=statuscode&utm_medium=email
Writing A Spotify Client in 16 Minutes in Emacs (video),http://www.youtube.com/watch?v=XjKtkEMUYGc
Parsing JSON with A Single Regex,http://blogs.perl.org/users/brian_d_foy/2013/10/parsing-json-with-a-single-regex.html?utm_source=statuscode&utm_medium=email
Docker on Raspberry Pi in 4 Simple Steps,http://resin.io/docker-on-raspberry-pi-in-4-simple-steps/?utm_source=statuscode&utm_medium=email
How We Saved 9GB of RAM with Python's __slots__,http://tech.oyster.com/save-ram-with-python-slots/?utm_source=statuscode&utm_medium=email
Towards Optimization-Safe Systems: Analyzing the Impact of Undefined Behavior [PDF],http://pdos.csail.mit.edu/~xi/papers/stack-sosp13.pdf?utm_source=statuscode&utm_medium=email
The Ethics of Unpaid Labor and the OSS Community,http://ashedryden.com/blog/the-ethics-of-unpaid-labor-and-the-oss-community?utm_source=statuscode&utm_medium=email
Safe; Efficient; and Portable Rotate in C/C++,http://blog.regehr.org/archives/1063?utm_source=statuscode&utm_medium=email
Conway's Game of Life in 336 Bytes of C,http://www.reddit.com/r/tinycode/comments/1ovzz7/conways_game_of_life_in_336_bytes_of_c/?utm_source=statuscode&utm_medium=email
Writing in a Dynamic Language? Naming Matters More.,http://www.bitnative.com/2013/10/18/dynamic-language-naming-matters-more/?utm_source=statuscode&utm_medium=email
Software Developer at Booking.com in Amsterdam!,http://www.booking.com/jobs/10795.en-us.html?sid=62f4bef905bcbadfdd1b2ee1c52d85c0;dcid=1

