title,link
Standards for Web Applications On Mobile: Current State and Roadmap,http://www.w3.org/2014/07/mobile-web-app-state/
After 5: What Happens With HTML after HTML5?,http://darobin.github.io/after5/
A Set of True JavaScript Controls Created Using ECMAScript 5,http://wijmo.com/5/
,http://wijmo.com/5/
High Performance Map Interactions using HTML5 Canvas,http://chairnerd.seatgeek.com/high-performance-map-interactions-using-html5-canvas/
Tim Berners-Lee: A Magna Carta for The Web,http://www.ted.com/talks/tim_berners_lee_a_magna_carta_for_the_web
Rethinking the Grid,http://snook.ca/archives/html_and_css/rethinking-the-grid
BareKit: A Bare Minimum Responsive Framework,http://appendto.com/2014/08/introducing-barekit-bare-minimum-responsive-framework/
Software Engineer in Computer Assisted Teaching (Brooklyn; NY),http://ch.tbe.taleo.net/CH14/ats/careers/requisition.jsp?org=WIRELESSGENERATION&cws=1&rid=3555
Google Adds User Account Menu to Chrome Canary,http://thenextweb.com/google/2014/08/14/google-adds-new-user-menu-chrome-canary-easy-account-switching-accessing-incognito-guest-modes/
Blink/Chromium team decides not to implement Pointer Events,https://code.google.com/p/chromium/issues/detail?id=162757#c64
Sass 3.4 is Released,http://blog.sass-lang.com/posts/221239-sass-34-is-released
Advanced Performance Tooling in Chrome DevTools,https://www.youtube.com/watch?v=0xx_dkv9DEY
The State of the Componentised Web,http://www.futureinsights.com/home/the-state-of-the-componentised-web.html
The 2014 Browser Battery Life Face-Off,http://www.anandtech.com/print/8327/browser-faceoff-battery-life-explored-2014
A Look at the Network Information API,http://code.tutsplus.com/tutorials/html5-network-information-api--cms-21598
Pure CSS Parallax Scrolling Websites,http://blog.keithclark.co.uk/pure-css-parallax-websites/
Making SVGs Responsive with CSS,http://tympanus.net/codrops/2014/08/19/making-svgs-responsive-with-css/
The latest issue of 'Mobile Web Weekly'; Our New Mobile Web Development Newsletter,http://mobilewebweekly.co/issues/20?euid=*%7CUNIQID%7C*
CSS Triggers: An Index of Which CSS Properties Cause Which Actions (Layout; Paint; Compositing),http://csstriggers.com/
The Pusher Realtime Reddit API,http://blog.pusher.com/pusher-realtime-reddit-api/
Finding Out The BPM of A Song on Spotify using the Web Audio API,http://jmperezperez.com/beats-audio-api/
Rec Room: A New Node-based Client Side App Building Utility Belt from Mozilla,https://hacks.mozilla.org/2014/08/time-to-get-hacking-introducing-rec-room/
Treo: Lightweight Wrapper Around IndexedDB (billed as like 'jQuery for IndexedDB'),https://github.com/alekseykulikov/treo
Kite: A Flexible Layout Helper CSS Library,http://hiloki.github.io/kitecss/
time-elements: Web component extensions to the standard 'time' element.,https://github.com/github/time-elements
Pikabu: A Flexible Framework for Off-Canvas Flyout Panels,http://mobify.github.io/pikabu/
A Heavyweight HTML5+CSS+JS Playground in the Cloud,https://codio.com/

