title,link
BrowserQuest: A Massively Multiplayer HTML5 Experiment,http://hacks.mozilla.org/2012/03/browserquest/
,http://hacks.mozilla.org/2012/03/browserquest/
Speed and Mobility: An Approach for HTTP 2.0 to Make the Web Faster,http://blogs.msdn.com/b/ie/archive/2012/03/25/speed-and-mobility-an-approach-for-http-2-0-to-make-mobile-apps-and-the-web-faster.aspx
Chrome Beats IE Market Share.. For One Day,http://www.theregister.co.uk/2012/03/22/chrome_number_one_for_a_day/
PDF.js powered built-in PDF support added to Firefox nightly,https://github.com/mozilla/mozilla-central/commit/59ecb6fc3b21ca3b883625c46101713afe78a762
CSS Regions: One Year In,http://blogs.adobe.com/webplatform/2012/03/16/css-regions-one-year-in/
The Top 5 Cross Platform Web Video Players,http://www.netmagazine.com/features/top-five-cross-platform-video-players
Adobe WebKit Hackathon Summary,http://blogs.adobe.com/webplatform/2012/03/22/adobe-webkit-hackathon-summary/
Content Folding using CSS Regions,http://css-tricks.com/content-folding/
Cache Them If You Can,http://www.stevesouders.com/blog/2012/03/22/cache-them-if-you-can/
Writing Chrome Extensions,http://drdobbs.com/mobile/232602420
My JS1K Entry: Making Music with the Audio Data API,http://tobyho.com/2012/03/19/my-jsk1-entry/
Foresight.js: Adaptive Image Support,https://github.com/adamdbradley/foresight.js
Maintaining CSS Style States using 'Infinite' Transition Delays,http://dabblet.com/gist/2076449
Envision: Fast; Dynamic and Interactive HTML5 Visualizations,http://www.humblesoftware.com/envision
Spedye: Reverse Proxy for HTTPS and SPDY Protocols,https://github.com/pquerna/spedye
CSS 3D Clouds,http://www.clicktorelease.com/code/css3dclouds/#
,http://www.clicktorelease.com/code/css3dclouds/#
Electric Potential Pong,http://www.dllu.net/pong/
Peter Cooper,http://twitter.com/peterc

