title,link
Chrome 22 Released as Stable: Includes Pointer Lock,http://blog.chromium.org/2012/09/enabling-new-classes-of-applications.html
Plan 2014: The Plan for HTML5 to Reach Recommendation Status,http://dev.w3.org/html5/decision-policy/html5-2014-plan.html
The HTML5 Developer Conference Registration Open (SF; October 15-16),http://html5devconf.com/
CSS Dev Conference - Honolulu; Hawaii - Dec. 5; 2012,http://cssdevconf.com/
Learn to use Adobe's new tools for designers and developers,http://www.adobe.com/devnet/html5/edge-tools-and-services-on-the-ADC.html
,http://www.adobe.com/devnet/html5/edge-tools-and-services-on-the-ADC.html
iPhone 5 and iOS 6 for HTML5 Developers; A Big Step Forward,http://www.mobilexweb.com/blog/iphone-5-ios-6-html5-developers
The Truth About Structuring An HTML5 Page,http://www.netmagazine.com/features/truth-about-structuring-html5-page
A Browser Benchmark That Has Your Back: RoboHornet,http://paulirish.com/2012/a-browser-benchmark-that-has-your-back-robohornet/
7 HTML5 Features That You May Not Know About,http://www.aaronlumsden.com/articles/7-html5-features-that-you-may-not-know-about/
WebSockets 101: A Technical Introduction,http://lucumr.pocoo.org/2012/9/24/websockets-101/
Browser Testing Across Devices With Adobe Edge Inspect,http://www.adobe.com/devnet/edge-inspect/articles/browser-testing-across-devices-with-adobe-edge-inspect.html
Live Web Audio Input Enabled (on Chrome Canary on OS X),http://updates.html5rocks.com/2012/09/Live-Web-Audio-Input-Enabled
Screensharing A Browser Tab in HTML5?,http://www.html5rocks.com/en/tutorials/streaming/screenshare/
Record Audio Using WebRTC and Do Server-Side Speech Recognition using WebSockets,http://www.smartjava.org/content/record-audio-using-webrtc-chrome-and-speech-recognition-websockets
Drawing Pixels is Hard,http://www.phoboslab.org/log/2012/09/drawing-pixels-is-hard
On Spinlocks and sleep(),http://www.webkit.org/blog/2136/on-spinlocks-and-sleep/
How to Create a CSS Flipping Animation,http://davidwalsh.name/css-flip
Code Editing with Edge Code,http://www.adobe.com/devnet/edge-code/articles/code-editing-with-edge-code.html
Oh Really; Why Is That? Web Performance for The Curious!,https://www.youtube.com/watch?v=kiPe7DPmEgE
CSS Flexbox Please!,http://demo.agektmr.com/flexbox/
CSS FilterLab: Explore CSS Filters and CSS Custom Filters.,http://html.adobe.com/webstandards/csscustomfilters/cssfilterlab/
Ejecta: Fast; Open Source JS; Canvas + Audio Implementation for iOS,http://impactjs.com/ejecta
HTML5 Blank WordPress Theme,http://www.toddmotto.com/html5blank/
Masking HTML Elements with Gradient-based Fadeouts,http://mir.aculo.us/2012/09/16/masking-html-elements-with-gradient-based-fadeouts/
DHTMLX Touch 1.2: Unitlist; New Charts; and More,http://www.dhtmlx.com/blog/?p=1782
Camvas: Library to Stream Webcam Content to A Canvas,http://cbrandolino.github.com/camvas/
foreman: A Quick and Dirty Helper for Web Workers,https://github.com/hezad/foreman
Front End UX Developer at Econsultancy (London; UK),http://econsultancy.com/jobs/front-end-ux-developer
A Globe from Google Maps With CSS Shaders,http://codepen.io/html5web/pen/pnbwo
,http://codepen.io/html5web/pen/pnbwo
WebGL Voxel Demo in the GLSL Sandbox,http://glsl.heroku.com/e#4053.1
Local Music Visualizer: Drag in an Audio File to Play and Visualize,http://cbrandolino.github.com/local-audio-visualizer/
HTML5 for Creatives: A Free Report by John Allsopp,http://www.webdirections.org/blog/html5-for-creatives/
Peter Cooper,http://twitter.com/peterc

