title,link
Firefox 7 Released: And It's Lean and Fast,http://hacks.mozilla.org/2011/09/firefox-7-is-lean-and-fast/
appMobi's Integrated HTML5 Game Development and Deployment Environment,http://www.appmobi.com/?q=node/204
Mulberry: A Development Framework for Native JS and HTML5 Mobile Apps,http://toura.github.com/mulberry/
GTK+ 3.2 Adds HTML5 Rendering - GTK Apps Can Render in the Browser,http://www.webupd8.org/2011/09/gtk-32-released-with-html5-allows.html
Seb Lee-Delisle's 'Creative JS and HTML5' Training,http://sebleedelisle.com/training/
SlideShare Ditches Flash for HTML5,http://engineering.slideshare.net/2011/09/slideshare-ditches-flash-for-html5/
Loading Large Assets in Modern HTML5 Games,http://smus.com/game-asset-loader
Browser Market Pollution: IE[x] is the new IE6,http://paulirish.com/2011/browser-market-pollution-iex-is-the-new-ie6/
Browser Speed Tests: Firefox 7; Chrome 14; Internet Explorer 9 and More,http://lifehacker.com/5844150/browser-speed-tests-firefox-7-chrome-14-internet-explorer-9-and-more
Building Offline Experiences with HTML5 AppCache and IndexedDB,http://blogs.msdn.com/b/ie/archive/2011/09/27/building-offline-experiences-with-html5-appcache-and-indexeddb.aspx
The Make Up of the Open Web Stack,http://dstorey.tumblr.com/post/10657722675/openwebstack
SPDY: What I Like About You,http://bitsup.blogspot.com/2011/09/spdy-what-i-like-about-you.html
onGameStart Retrospective: A Bright Future for HTML5 Games,http://blog.pusher.com/2011/9/26/ongamestart-a-bright-future-for-html5-games
Pulse: A Pulsing Pin-Point Effect,http://moeedm.com/sandbox/pulse/
,http://moeedm.com/sandbox/pulse/
Sassy Mother Effing Text Shadow,http://sassymothereffingtextshadow.com/
10 HTML5-Ready Blank; Bare-Bones Themes for Wordpress,http://speckyboy.com/2011/04/25/10-html5-ready-blank-bare-bones-and-naked-themes-for-wordpress/
Drag and Drop Website Editing (in 10KB),http://10k.aneventapart.com/Entry/Details/659
jsprobes: Cross-Platform Browser Instrumentation using JavaScript,http://brrian.tumblr.com/post/10571624125/jsprobes-cross-platform-browser-instrumentation-using
HTML5 Video Face Detection with Canvas and Javascript,http://wesbos.com/html5-video-face-detection-canvas-javascript/
,http://wesbos.com/html5-video-face-detection-canvas-javascript/
Volkswagen Beetle's HTML5 Concept Site,http://www.beetle.de/full/
,http://www.beetle.de/full/
Peter Cooper,http://twitter.com/peterc

