title,link
Taking Advantage of Multi-Processor/Core Environments in Node.js,http://blog.carbonfive.com/2014/02/28/taking-advantage-of-multi-processor-environments-in-node-js/
Node v0.11.12 (Unstable),http://blog.nodejs.org/2014/03/12/node-v0-11-12-unstable/
A Heavyweight Node.js Playground in the Cloud,https://codio.com/
10 Habits of a Happy Node Hacker,https://blog.heroku.com/archives/2014/3/11/node-habits
A Node and Raspberry Pi-backed Ambient Lighting System,http://blog.lastlog.de/posts/tinkerforge_relais_rapspberry_pi/
Why Node.js Is Becoming The Go-to Technology in The Enterprise,http://www.nearform.com/nodecrunch/node-js-becoming-go-technology-enterprise
Building Secure Node.js Applications,http://blog.safaribooksonline.com/2014/03/12/building-secure-node-js-applications/
Top Overlooked Security Threats to Node.js Web Applications,https://speakerdeck.com/ckarande/top-overlooked-security-threats-to-node-dot-js-web-applications
Mach: A Better Way to Build Web Servers in Node?,https://github.com/mjijackson/mach
Shmock: An Express-Based HTTP Mocking Library for Node.js,http://tech.gilt.com/post/78877878592/shmock-an-express-based-http-mocking-library-for
Discover The License Footprint of Your Node Application,https://github.com/3rd-Eden/licensing
StyleStats: A Node.js Library to Collect CSS Statistics,https://github.com/t32k/stylestats
Cha: jQuery-style Task Chaining in Node,https://github.com/chajs/cha
vimtronner: A Multiplayer; Command-line vim Trainer Built on Node.js and Socket.io,http://blog.carbonfive.com/2014/02/03/vimtronner-a-multiplayer-command-line-vim-trainer-built-on-node-js-and-socket-io/
ninit: Community-driven Node.js Module Bootstrap Code,http://akoenig.github.io/ninit/

