title,link
Node v0.10.28 (Stable) Released,http://blog.nodejs.org/2014/05/02/node-v0-10-28-stable/
Generators in Node.js: Common Misconceptions and Three Good Use Cases,http://strongloop.com/strongblog/how-to-generators-node-js-yield-use-cases/
A Heavyweight Node.js Playground in the Cloud,https://codio.com/
,https://codio.com/
Simple Content Management with Node.js and Markdown,http://flippinawesome.org/2014/05/05/simple-content-management-with-node-js-and-markdown/
Writing Selenium Tests with Node (The Enjoyable Way),http://bitcubby.com/writing-selenium-tests-with-node-the-enjoyable-way/
Edge.js Brings Node and .NET Together On Three Platforms,http://www.hanselman.com/blog/ItsJustASoftwareIssueEdgejsBringsNodeAndNETTogetherOnThreePlatforms.aspx
Node.js Performance Tip of the Week: Memory Leak Diagnosis,http://strongloop.com/strongblog/node-js-performance-tip-of-the-week-memory-leak-diagnosis/
Roll Your Own Asset Pipeline with Gulp,http://blog.carbonfive.com/2014/05/05/roll-your-own-asset-pipeline-with-gulp/
The Absolute Beginner’s Guide to Node.js,http://blog.codeship.io/2014/05/07/nodejs-beginners-guide.html
Detecting File Type in Node,http://h3manth.com/new/blog/2014/detecting-file-type-in-node-and-browser/
How Node.JS Applications Will Benefit From Replacing V8 with JXcore,http://oguzbastemur.blogspot.co.uk/2014/05/how-nodejs-applications-will-benefit.html
The History of Node.js Streams,https://www.youtube.com/watch?v=g5ewQEuXjsQ
Build a Killer Node.js Client for Your REST+JSON API,https://stormpath.com/blog/build-a-killer-node-dot-js-client-for-your-rest-plus-json-api/
Full Stack JS Amber: A Boilerplate with Ember On The Client and A Node Server API,http://www.100percentjs.com/introducing-full-stack-js-amber-boilerplate-ember-client-node-server-api/
Mock-Couch: A CouchDB Server for your Unit Tests,https://github.com/chris-l/mock-couch
Starsky: A High-Level Node Module for Building Services on RabbitMQ,https://blog.recurly.com/2014/05/open-sourced-starsky/
Want to Calculate The Travel Distance From New York to San Francisco in Node?,http://npmawesome.com/posts/2014-05-01-google-distance/
Google Distance Matrix API.,https://developers.google.com/maps/documentation/distancematrix/
Node v0.11.13 (Unstable) Released,http://blog.nodejs.org/2014/05/02/node-v0-11-13-unstable/
sentiment: To Perform Sentiment Analysis in Node.js,https://blog.nodejitsu.com/npmawesome-sentiment/
Thinky: A Node JavaScript ORM for RethinkDB,http://thinky.io/documentation/introduction/
A 10 Week Residence for Highly Skilled Engineers,http://significancelabs.org/hackers/

