title,link
nodeschool.io: Learn Node.js with Interactive Lessons,http://nodeschool.io/
,http://nodeschool.io/
How to Use Node and Photoshop Generator to Script Adobe Photoshop CC,http://www.leebrimelow.com/introduction-to-photoshop-generator/
Deploy Node.js apps easily with Heroku,https://devcenter.heroku.com/articles/getting-started-with-nodejs
,https://devcenter.heroku.com/articles/getting-started-with-nodejs
7 Tips for A Node.js Padawan,https://medium.com/tech-talk/e7c0b0e5ce3c
Chrome V8's Launch Process and Guidelines,https://developers.google.com/v8/launchprocess
A Taste of FruitJS,http://flippinawesome.org/2013/09/16/a-taste-of-fruitjs/
How to Upload Pictures From A PhoneGap Application to Node.js,http://coenraets.org/blog/2013/09/how-to-upload-pictures-from-a-phonegap-application-to-node-js-and-other-servers-2/
An Introduction to Dependency Injection in Node.JS,http://tech.i.tv/09-17-2013/dependency-injection-in-nodejs/
I've Written A Node CLI.. So Now What?,http://www.jonathanfielding.com/ive-written-a-node-cli-so-now-what/
TripleSec: Triple-Paranoid Symmetric Encryption Library,https://keybase.io/triplesec/
RESTly: A Simple and Lightweight REST API Framework,https://github.com/MattCollins84/restly
Getting Hierchical Data From Redis with Node.js,http://stackoverflow.com/q/18826583/3951
modQuery: Create SQL Queries Functionally with JavaScript,https://github.com/BagosGiAr/modQuery
node-argp: Command-line Option Parser for Node.js,https://github.com/gagle/node-argp
build-brite: A Physical Build Indicator Using Arduino; A Tri-color LED; and johnny-five,https://github.com/SaraJo/build-brite
Wintersmith: Flexible; Minimalist Node.js Static Site Generator,http://wintersmith.io/
Chocolate.js: A Simple Webapp Framework Built on Node.js using CoffeeScript,http://blog.strongloop.com/in-the-loop-chocolate-js-a-simple-webapp-framework-built-on-node-js-using-coffeescript/
The O'Reilly Fluent Conference 2014 Call for Proposals Is Open,http://fluentconf.com/fluent2014/public/cfp/286

