title,link
Slap: A Sublime-like Terminal-based Text Editor Written in Node,https://github.com/slap-editor/slap
Turning Node Applications Into Executables with JXcore,http://jxcore.com/turn-node-applications-into-executables/
Frontend Masters: New Hardcore Functional Programming in JavaScript Course,https://frontendmasters.com/courses/functional-javascript/
this free lesson.,http://frontendmasters.com/courses/functional-javascript/function-composition/
,https://frontendmasters.com/courses/functional-javascript/
Checking for Vulnerable npm Modules,http://nodeexamples.com/2014/08/16/checking-for-vulnerable-node-js-modules/
Tint: Compile Native Applications with JavaScript; CSS; HTML5 and Node,https://github.com/trueinteractions/tint2
Avatar: To Build AvatarJS; A Java Node.js Implementation,https://github.com/timboudreau/avatar
Redbird: A Reverse Proxy for Node,https://github.com/OptimalBits/redbird
Senior Software Engineer (Front End),http://www.jobscore.com/jobs2/beachmint/senior-software-engineer-front-end/cN4ic2kySr5ixhiGalkWKP?ref=rss&sid=68
Why The JavaScript World Is Still Waiting For Node.js 1.0,http://readwrite.com/2014/08/22/nodejs-node-js-tj-fontaine-version-10
Click to Deploy MEAN Development Stack on Google Compute Engine,http://googlecloudplatform.blogspot.com/2014/08/click-to-deploy-mean-development-stack-on-google-compute-engine.html
Upcoming Breaking C++ API Changes in Node.js v0.12,http://strongloop.com/strongblog/node-js-v0-12-c-apis-breaking/
Building Synchronization Constructs with Node + Redis,http://joeywhelan.blogspot.com/2014/08/synchronization-constructs-with-node.html
Avoiding Command Injection when Executing System Commands from Node.js,https://blog.liftsecurity.io/2014/08/19/Avoid-Command-Injection-Node.js
Compiling Native Node Addons on OS X 10.9,http://andrewaustin.com/compiling-native-node-addons-on-os-x-10-9/
How to Create A Contact Form with A CAPTCHA in Node.js,http://www.codeoftheory.com/blog/post/how-to-create-a-contact-form-with-a-captcha-in-nodejs
Get the door; Javes! Understanding Sync & Async in JavaScript,https://www.discovermeteor.com/blog/understanding-sync-async-javascript-node/
10 Tips to Make Your Node.js Web App Faster,http://www.sitepoint.com/10-tips-make-node-js-web-app-faster/
Real-time Gaming with Node.js + WebSocket on Google Cloud Platform,https://cloud.google.com/developers/articles/real-time-gaming-with-node-js-websocket-on-gcp
Monolithic to Distributed: How Artsy Transitioned from Rails to Node.js and Isomorphic JavaScript,http://www.hakkalabs.co/articles/monolithic-to-distributed-how-artsy-transitioned-from-ruby-on-rails-to-node-js-and-isomorphic-javascript
dtimer: A Redis-Backed Distributed Timer,https://github.com/enobufs/dtimer
castv2-client: A Node.js Chromecast Client Based on the New (CASTV2) Protocol,https://github.com/thibauts/node-castv2-client
Fruit Loops: Server-side jQuery API Renderer,https://github.com/walmartlabs/fruit-loops
Node Program: Node; MongoDB and Express Intensive In-Person Bay Area Course,http://nodeprogram.eventbrite.com/?aff=nodewkly&afu=5905208113
Joyent; Inc.,http://www.joyent.com/

