title,link
Node.js Tools 1.0 for Visual Studio Released,http://blogs.msdn.com/b/visualstudio/archive/2015/03/25/node-js-tools-1-0-for-visual-studio.aspx
Ten Common Mistakes in Node.js Development,http://www.toptal.com/nodejs/top-10-common-nodejs-developer-mistakes
Test an Email API service in less than 5 minutes,https://sendgrid.com/docs/Utilities/code_workshop.html?utm_source=cooper-press&utm_medium=content-advertising&mc=Content-Advertising&mcd=cooper-press&cvosrc=content-advertising.cooper-press.node-news&cvo_adid=node-news&cvo_cid=newsletter
,https://sendgrid.com/docs/Utilities/code_workshop.html?utm_source=cooper-press&utm_medium=content-advertising&mc=Content-Advertising&mcd=cooper-press&cvosrc=content-advertising.cooper-press.node-news&cvo_adid=node-news&cvo_cid=newsletter
Node v0.12.1 (Stable) Released,http://blog.nodejs.org/2015/03/23/node-v0-12-1-stable/
Using Twilio to Advance the State of Wedding Tech,https://www.airpair.com/node.js/posts/using-twilio-to-advance-the-state-of-wedding-tech
Getting an A+ on the SSL Labs Test in Node.js,https://certsimple.com/blog/a-plus-node-js-ssl
Getting Started with Jasmine for Behavior Driven Dev,https://semaphoreci.com/community/tutorials/getting-started-with-node-js-and-jasmine
Node.js Production Checklist,http://blog.risingstack.com/node-js-production-checklist/
Front-end developer at Econify (New York; NY),http://www.econify.com/job/E100431
Freelance with Companies like Airbnb; IDEO & JPMorgan,http://www.toptal.com/developers?utm_source=node_weekly&utm_medium=cpm-newsletter&utm_campaign=node_weekly_job
io.js 1.6.2 Released,https://github.com/iojs/io.js/blob/v1.x/CHANGELOG.md#2015-03-23-version-162-rvagg
Node v0.10.38 (Maintenance) Released,http://blog.nodejs.org/2015/03/23/node-v0-10-38-maintenance/
Async JS Workshop Online with Jafar Husain (Netflix and TC39),https://frontendmasters.com/workshops/async-javascript/
A FAQ About JXCore; A Fork of Node.js for Mobile Platforms,http://www.goland.org/jxcore/
Using Angular’s New Improved Browserify Support,http://blog.npmjs.org/post/114584444410/using-angulars-new-improved-browserify-support
Build A Real-time SMS Call Center with Node; Data McFly and Twilio,https://www.airpair.com/javascript/posts/build-a-realtime-sms-call-center-with-data-mcfly-and-twilio
Unit Testing with Mocks in Node,http://vansande.org/2015/03/22/unit_testing_with_mocks_in_node_js/
Complete Express.js + Node.js + MongoDB CRUD & REST Skeleton,https://www.airpair.com/javascript/complete-expressjs-nodejs-mongodb-crud-skeleton
Async Tasks with ES6 Generators,http://schempy.com/async_tasks_with_es6_generators
A Quick Intro to Azure DocumentDB's Server-Side JavaScript,http://channel9.msdn.com/Blogs/Windows-Azure/Azure-Demo-A-Quick-Intro-to-Azure-DocumentDBs-Server-Side-Javascript
Get the highest performance Redis tools and analytics from RedisGreen,http://www.redisgreen.net/docs.html&utm_campaign=perf0
Introducing the Node.js MongoDB 2.0 Driver,https://www.mongodb.com/blog/post/introducing-nodejs-mongodb-20-driver
hsc: Comprehensive HTTP Status Code Information in Node.js Made Easy,https://github.com/qw3rtman/hsc
Joyent; Inc.,http://www.joyent.com/

