title,link
io.js Is Moving to The Node.js Foundation; with A Merge in Progress,http://venturebeat.com/2015/05/13/node-project-spinoff-io-js-is-moving-to-the-node-js-foundation-with-a-merge-in-progress/
was here.,https://github.com/iojs/io.js/issues/1664#issuecomment-101828384
Building A Simple Command Line Tool with npm,http://blog.npmjs.org/post/118810260230/building-a-simple-command-line-tool-with-npm
Performance Showdown: Node.js vs. io.js v2.0.0,https://raygun.io/blog/2015/05/performance-showdown-node-js-vs-io-js-v2-0-0/
Send transactional email in a NodeJS app using the Mailgun API,http://blog.mailgun.com/how-to-send-transactional-emails-in-a-nodejs-app-using-the-mailgun-api/&utm_content=may14&utm_campaign=nodejsblog
,http://blog.mailgun.com/how-to-send-transactional-emails-in-a-nodejs-app-using-the-mailgun-api/&utm_content=may14&utm_campaign=nodejsblog
Node v0.12.3 (Stable) Released,http://blog.nodejs.org/2015/05/13/node-v0-12-3-0.12.3/
Microsoft's Node Fork That Enables Node to use Chakra as its JavaScript engine.,https://github.com/Microsoft/node
Clor: Terminal Text Coloring and Styling,https://github.com/bucaran/clor
A Next Chapter for T J Fontaine; Steps Back from Node,http://blog.nodejs.org/2015/05/08/next-chapter/
left Joyent.,http://venturebeat.com/2015/05/08/node-lead-tj-fontaine-is-stepping-down-and-leaving-joyent-too/
a foundation leading things rather than an individual.,http://blog.nodejs.org/2015/05/08/transitions/
craigslist seeks JavaScript Developers (San Francisco; CA),http://sfbay.craigslist.org/sfc/eng/4919342771.html#?
Bringing Node.js to Windows 10 IoT Core,http://blogs.windows.com/buildingapps/2015/05/12/bringing-node-js-to-windows-10-iot-core/
Workshop: Building Real-Time Web Applications with Meteor.js,https://frontendmasters.com/workshops/meteor-js/
online or in-person May 28th & 29th.,https://frontendmasters.com/workshops/meteor-js/
Deploying with npm Private Modules,http://blog.npmjs.org/post/118393368555/deploying-with-npm-private-modules
Intro to Node on AWS Lambda for S3 and Kinesis,http://eng.localytics.com/taming-aws-lambda-for-s3-and-kinesis-at-localytics/
Building A Travel App in 2 Hours with Sabre; LumX; NodeJS and Angular,https://www.airpair.com/angularjs/posts/travel-app-in-2-hours
Getting Started with the Node.js LoopBack Connector for ArangoDB,https://strongloop.com/strongblog/getting-started-with-node-js-loopback-connector-for-arangodb/
Get the highest performance Redis tools and analytics from RedisGreen,http://www.redisgreen.net/docs.html&utm_campaign=perf0
Parsec: Generator-Based CLI Options Parser,https://github.com/bucaran/parsec
flickr-set-get: A Command Line App to Download Photos From Flickr,http://loige.co/introducing-flickr-set-get-a-command-line-app-to-download-photos/
mut: A Mini Unit Testing Module,https://github.com/hit9/mut
NodeSession: Session Handling for Node,https://github.com/quorrajs/NodeSession
Joyent; Inc.,http://www.joyent.com/

