title,link
Apostrophe: A Node-based Content Management System,https://github.com/punkave/apostrophe
See a live demo in action.,http://demo2.apostrophenow.com/
Node v0.11.8 (Unstable) Released,http://blog.nodejs.org/2013/10/30/node-v0-11-8-unstable/
node-jvm: A Java Virtual Machine Implemented in Node.js,https://github.com/YaroslavGaponov/node-jvm#!
Introduction to Sails.js,http://net.tutsplus.com/tutorials/javascript-ajax/introduction-to-sails-js/
Building a ToDo App with Express.js/Node.js and MongoDB,http://webapplog.com/todo-app-with-express-jsnode-js-and-mongodb
Dismantling the Monoliths,https://engineering.groupon.com/2013/misc/i-tier-dismantling-the-monoliths/
Prereleases on NPM,http://carrot.is/coding/npm_prerelease
Checking for Copyright Headers in Your Source Code using GruntJS,http://nodeexamples.com/2013/10/29/checking-for-copyright-headers-in-your-source-code-using-gruntjs/
“Node”-assemble Johnny-Five,http://www.youtube.com/watch?v=jGIqVlJaMc4
TingoDB: Embedded JavaScript Database for Node.js and node-webkit,http://www.tingodb.com/
dsjslib: A Collection of Data Structures and Utilities,https://github.com/monmohan/dsjslib
Duration.js: Parsing and Creating Durations,https://github.com/icholy/Duration.js
Building Multiplayer HTML5 Games with Cloak,http://weblog.bocoup.com/building-multiplayer-html5-games-with-cloak/
ExpressWorks: Automated Express.js/Node.js Workshop,http://webapplog.com/expressworks/
id3.js: Parser for ID3 Tags (in MP3 Files),https://github.com/43081j/id3
Nombo: Scalable Realtime Framework for Node.js,http://nombo.io/
Regenerator: Bringing ES6 Generator Functions to Today's JavaScript (ES5),https://github.com/facebook/regenerator
ThreePin: A Stress-Free socket.io Client Debugger and Test Environment,https://github.com/dieguitoweb/ThreePin
Nunjucks: Rich and Powerful Templating Language for JavaScript,http://jlongster.github.io/nunjucks/
Agenda: A Lightweight Job Scheduling Library for Node.js,https://github.com/rschmukler/agenda
load-grunt-tasks: Load Multiple Grunt Tasks using Globbing Patterns,https://github.com/sindresorhus/load-grunt-tasks
time-grunt: Displays The Elapsed Execution Time of Grunt Tasks,https://github.com/sindresorhus/time-grunt
Cob: Read and Manipulate JSON,https://github.com/jarofghosts/cob
Full Stack JavaScript Developer (Bristol; UK),http://careers.stackoverflow.com/jobs/42521/full-stack-javascript-developer-help-us-blue-speck-financial-ltd
Stay Up-to-Date with Node.js Packages using the 'npm-onupdate' Service,http://outof.me/stay-up-to-date-with-node-js-packages-using-npm-onupdate-service/

