title,link
Node v0.12.5 (Stable) Released,http://blog.nodejs.org/2015/06/22/node-v0-12-5-stable/
8 Talks from NodeConf Oneshot Oslo 2015,https://www.youtube.com/watch?v=HpOSSZHkdzw&list=PLU1Iy0GYsI-r5DYwpNaxquBmaYaxZINYo&index=1
Understanding npm: A Visualization of npm's Size,https://unpm.nodesource.com/
Simple Node.js Application Hosting - Try Today for Free,http://hubs.ly/y0MJgR0
get started for free,http://hubs.ly/y0MJgR0
,http://hubs.ly/y0MJgR0
io.js 2.3.1 Released,https://github.com/nodejs/io.js/blob/master/CHANGELOG.md#2015-06-23-version-231-rvagg
Node v0.10.39 (Maintenance) Released,http://blog.nodejs.org/2015/06/22/node-v0-10-39-maintenance/
How to Use Rust with Node.js When Performance Matters,http://blog.risingstack.com/how-to-use-rust-with-node-when-performance-matters/
Debugging Node.js Memory Leaks,http://blog.flowdock.com/2015/06/22/debugging-node-js-memory-leaks/
Running Your Node and Express Apps Forever with Systemd and PM2,http://www.terlici.com/2015/06/20/running-node-forever.html
Vantage: A Distributed; Interactive CLI for Your Existing Application,https://github.com/dthree/vantage
a quick tutorial about it.,http://dailyjs.com/2015/06/23/add-a-cli-to-node-apps-with-vantage/
Expert Node.js Instructors at Pluralsight (Freelance-Part-time),http://www.pluralsight.com/teach
3-Day Workshop on API Design in Node.js,https://frontendmasters.com/workshops/api-design-nodejs/
Create and Verify JSON Web Tokens with Node.js,https://stormpath.com/blog/nodejs-jwt-create-verify/
Dockerizing A Node.js Web App,https://docs.docker.com/examples/nodejs_web_app/
Painless Microsoft SQL Server with Node.js and seriate,http://developer.leankit.com/painless-sql-server-with-nodejs-and-seriate/
Using RethinkDB with ExpressJS,https://www.airpair.com/javascript/posts/using-rethinkdb-with-expressjs
Using MySQL with Node.js and the node-mysql JS Client,http://www.sitepoint.com/using-node-mysql-javascript-client/
Containerizing Node.js Apps with Docker and StrongLoop,https://strongloop.com/strongblog/containerizing-node-js-apps-with-docker-and-strongloop/
Deploying Multiple Node.js Apps with strong-pm.io,https://strongloop.com/strongblog/deploying-multiple-node-js-apps-with-strong-pm-io/
Get the highest performance Redis tools and analytics from RedisGreen,http://www.redisgreen.net/docs.html&utm_campaign=perf0
slackbotapi: Node.js Slack Real Time Messaging API Module,https://github.com/xBytez/slackbotapi
Cool Modules from NodeConf,https://gist.github.com/beaugunderson/97e5e03fff14da8073dc
elasticsearch-csv: A Simple Elasticsearch CSV Importer Node Library,https://github.com/robertstettner/elasticsearch-csv
better-log: console.log Wrapper for More Readable Output in Node,https://github.com/RReverser/better-log
drilldown: Safely Access Deeply Nested Properties of Objects,https://github.com/d10n/drilldown
Joyent; Inc.,http://www.joyent.com/

