title,link
Archives,http://postgresweekly.com/issues
Checking for PostgreSQL Bloat,http://www.keithf4.com/checking-for-postgresql-bloat/
PoWA: A Postgres Workload Analyzer,https://dalibo.github.io/powa/
EnterpriseDB Aims for Easier NoSQL Dev with Free Postgres AWS Tools,http://www.zdnet.com/enterprisedb-aims-for-easier-nosql-dev-with-free-postgres-aws-tools-7000032743/
Biggish Data With Rails and PostgreSQL,https://www.youtube.com/watch?v=rVrsaL_PnYE&list=UUWnPjmqvljcafA0z2U1fwKQ
Postgres-XL: Open Source Scalable SQL Database Cluster,http://www.postgres-xl.org/
Relational Database Technologies: Deadlocks in PostgreSQL,http://raghavt.blogspot.com/2011/11/deadlocks-in-postgresql.html
Porting SQLite3 Data to PostgreSQL Database in Rails 4,http://blog.flatironschool.com/post/68064669290/porting-sqlite3-data-to-postgresql-database-in-rails-4
Craig Kerstiens,http://craigkerstiens.com/

