title,link
View this newsletter on the Web,http://dartweekly.com/archive/27.html
see the issue archive,http://dartweekly.com/archive/
,http://dartweekly.com/
Dartwatch.com,http://blog.dartwatch.com/
Google preps Dart 1.0 to challenge JavaScript,http://www.infoworld.com/t/web-development/google-preps-dart-10-challenge-javascript-219015
Dart project co-founders answer your questions,http://news.dartlang.org/2013/05/dart-project-co-founders-answer-your.html
8 Dart Features Those Fat Cats Don’t Want You to Know,http://programming.oreilly.com/2013/05/8-dart-features-those-fat-cats-dont-want-you-to-know.html
State of Dart after Google IO 2013,http://www.webdevelopment.nicholastuck.com/dart/state-of-dart-after-google-io-2013/
Forms; HTTP servers; and Web Components with Dart,http://blog.sethladd.com/2013/06/forms-http-servers-and-web-components.html
Numeric Computation | Dart: Structured web apps,https://www.dartlang.org/articles/numeric-computation/
Dart plugin for WebStorm and IntelliJ-based IDEs is open sourced,http://www.youtube.com/watch?v=zJYdtZ3HHJY
Google Drive SDK: Writing your first Drive app in Dart,https://google-developers.appspot.com/live/shows/31119462
Dart Meetup at Latvian Developers Network (Riga),http://www.meetup.com/Latvian-Developers-Network/events/121787622/
Dart Web App Essentials Training Course - Marakana,http://marakana.com/training/dart/dart_web_app_essentials.html
JavaScript Weekly,http://javascriptweekly.com/
Ruby Weekly,http://rubyweekly.com/
Click here to subscribe to Dart Weekly.,http://dartweekly.com/
dartweekly.com,http://dartweekly.com/

