title,link
Node v0.10.0 (Stable) Released,http://blog.nodejs.org/2013/03/11/node-v0-10-0-stable/
What's New in Node 0.10 post,http://blog.strongloop.com/whats-new-in-node-v0-10/
New Working Draft of ECMAScript 6 Available,http://wiki.ecmascript.org/doku.php?id=harmony:specification_drafts#current_working_draft
Are you a mobile web developer?,http://bdconf.com/html5
BDConf,http://bdconf.com/html5
,http://bdconf.com/html5
Getting Into Ember.js,http://net.tutsplus.com/tutorials/javascript-ajax/getting-into-ember-js/
The Strategy Design Pattern in JavaScript,http://sokolmichael.com/posts/2013-03-08-strategy-design-pattern-in-javascript
Using Google's Closure to Compile and Verify Your JavaScript,http://coreymaynard.com/blog/using-googles-closure-to-compile-and-verify-your-j/
A Subtle Difference Between Window Properties and Global Variables,http://tobyho.com/2013/03/13/window-prop-vs-global-var/
ECMAScript 6 and Spread Operator,http://ariya.ofilabs.com/2013/03/es6-and-spread-operator.html
JavaScript Asynchronous Architectures: Events vs. Promises,http://www.joezimjs.com/javascript/javascript-asynchronous-architectures-events-vs-promises/
Inter-Window Messaging Using localStorage,http://bens.me.uk/2013/localstorage-inter-window-messaging
AngularJS for jQuery Developers,http://blog.artlogic.com/2013/03/06/angularjs-for-jquery-developers/
What’s The Difference Between Currying and Partial Application?,http://raganwald.com/2013/03/07/currying-and-partial-application.html
Ben Alman,http://benalman.com/news/2012/09/partial-application-in-javascript/
Axel Rauschmayer,http://www.2ality.com/2011/09/currying-vs-part-eval.html
Tracking Down A Memory Leak in Node.js and Socket.IO,http://jpallen.net/2013/03/08/tracking-down-a-memory-leak-in-node-js-and-socket-io/
Meteor 0.5.8: Security Fix; AppCache; DB Transforms; New Deps,http://www.meteor.com/blog/2013/03/13/meteor-058-security-fix-appcache-db-transforms-new-deps
YUI 3.9.0 Released,http://www.yuiblog.com/blog/2013/03/13/announcing-yui-3-9-0/
What’s New in NetBeans 7.3: HTML5!,http://www.sitepoint.com/netbeans-73-html5-support/
Sails.js: Rails-Like MVC Framework for Node.js,http://balderdashy.github.com/sails/
Formula.js: JavaScript Implementations of Spreadsheet Formula Functions,http://stoic.com/formula/
FieldState: Minimise Your DOM Logic for Form Field Control,http://www.mitya.co.uk/fieldState/
Piping: Live Code Reloading On Node.js Without External Scripts,https://github.com/mdlawson/piping
Epoxy.js : Elegant Data Binding for Backbone,http://epoxyjs.org/
Abba: JavaScript A/B Testing,http://blog.alexmaccaw.com/abba
Countable.js: Live Word Counting in JavaScript,http://radlikewhoa.github.com/Countable/
Pixi.js: A Fast HTML 5 2D Rendering Engine That Uses WebGL with Canvas Fallback,https://github.com/GoodBoyDigital/pixi.js
a blog post,http://www.goodboydigital.com/pixi-js-has-landed/
a demo game to enjoy.,http://www.goodboydigital.com/runpixierun/
Runnable: Run Server-Side Code and Discover APIs in Your Browser,http://runnable.com/
Front-End Brainiac at VividCortex,https://vividcortex.com/jobs.html
Javascript Guru (San Francisco; CA),http://www.krux.com/pro/who_we_are/careers/javascript_guru/
Senior Software Engineer (Front End) at Gigwalk.com (San Francisco),http://gigwalk.com/careers/seniorFrontEnd
Ember.JS Gets an Official Discussion Forum,http://discuss.emberjs.com/

