title,link
Node 0.4 Released,http://groups.google.com/group/nodejs/browse_thread/thread/c57a53aaf0d74a5a
Popcorn.js 0.2 Released,http://weblog.bocoup.com/popcorn-js-0-2-released
Nodester - Node's Answer to Heroku?,http://nodester.com/
How to Write Maintainable OO JavaScript Code,http://msdn.microsoft.com/en-US/scriptjunkie/gg602402.aspx
Using Deferreds in jQuery 1.5,http://www.erichynds.com/jquery/using-deferreds-in-jquery/
Fun with jQuery Deferred,http://intridea.com/2011/2/8/fun-with-jquery-deferred
On Bruno's Concern About the Current Coupling of node.js and V8,http://joyeur.com/2011/02/05/on-brunos-concern-about-the-current-coupling-of-node-js-and-v8/
The Difference Between jQuery's .bind(); .live(); and .delegate(),http://www.alfajango.com/blog/the-difference-between-jquerys-bind-live-and-delegate/
Sinon.JS - Versatile standalone test spies; stubs and mocks for JavaScript,http://sinonjs.org/
Query: jQuery For The Command Line,https://github.com/visionmedia/query
Treesaver,http://treesaverjs.com/
ql_zoom: Canvas-Powered Image Zooming,http://quickleft.github.com/ql_zoom/
Introducing Gmailr: A Javascript API for Gmail,http://www.jamesyu.org/2011/02/05/introducing-gmailr-an-unofficial-javscript-api-for-gmail/
davis.js: RESTful Degradable JavaScript Routing,https://github.com/olivernn/davis.js
mapKey: jQuery Keyboard Shortcuts,http://pixelmatrixdesign.com/weblog/comments/introducing_mapkey/
Isotope: Auto Sorting and Filtering Layout Plugin,http://isotope.metafizzy.co/
KuraFire/runloop - GitHub,https://github.com/KuraFire/runloop
25 Videos from the 2010 jQuery Conference,http://events.jquery.org/2010/boston/video/

