title,link
Processing.js v1.0 Released,http://processingjs.org/blog/?p=250
Essential JavaScript And jQuery Design Patterns - A New; Free Book,http://addyosmani.com/blog/essentialjsdesignpatterns/
JSMentors: A JavaScript discussion mailing list,http://jsmentors.com/
Prototype 1.7 Released (Sort Of..),https://github.com/sstephenson/prototype
Sencha Touch 1.0 Ships - Now Free!,http://www.sencha.com/blog/2010/11/15/sencha-touch-1-0-ships-now-free/
Higher Order JavaScript (and CoffeeScript),http://www.bofh.org.uk/2010/11/18/higher-order-javascript
Google Instant Previews: Under the hood,http://googlecode.blogspot.com/2010/11/instant-previews-under-hood.html
Nine New-ish jQuery Features Worth Trying,http://www.developer.com/lang/jscript/nine-new-ish-jquery-features-worth-trying.html
Writing Clean Maintainable JavaScript,http://developers.freshbooks.com/blog/view/writing_clean_maintainable_javascript/
jQuery's Data Method - How and Why to Use It,http://tutorialzine.com/2010/11/jquery-data-method/
Emulating Lossy RGBA Images with HTML5's Canvas Element,http://kaioa.com/node/104
What is currently the best book for learning JavaScript?,http://www.reddit.com/r/javascript/comments/e54i9/what_is_currently_the_best_book_for_learning/
Getting Started with WebGLU,http://blog.one-geek.com/2010/11/getting-started-with-webglu.html
jSignature - Web signatures jQuery plugin,http://www.unbolt.net/jSignature/
glob-trie.js: High performance pattern matching for Node,https://github.com/rbranson/glob-trie.js
Douglas Crockford's JSLint now on GitHub,https://github.com/douglascrockford/JSLint
The JS Rosetta Stone,http://www.jsrosettastone.com/

