title,link
Introducing T3: Enabling Large Scale JavaScript Apps,https://www.box.com/blog/introducing-t3-enabling-large-scale-javascript-applications/
the examples,http://t3js.org/examples/
New Number and Math Features in ES6,http://www.2ality.com/2015/04/numbers-math-es6.html
(re)Introducing eSpeak.js: Web-Based Text to Speech,http://blog.monotonous.org/2015/04/14/reintroducing-espeak-js/
demo,http://eeejay.github.io/espeak/emscripten/espeak.html
Transactional HTML Email Templates Free for Download,http://blog.mailgun.com/transactional-html-email-templates/?utm_source=HTML5WeeklyJan28&utm_medium=Email&utm_campaign=BlogPostTransactionalEmail
Download now.,http://blog.mailgun.com/transactional-html-email-templates/?utm_source=HTML5WeeklyJan28&utm_medium=Email&utm_campaign=BlogPostTransactionalEmail
,http://blog.mailgun.com/transactional-html-email-templates/?utm_source=HTML5WeeklyJan28&utm_medium=Email&utm_campaign=BlogPostTransactionalEmail
ES6 Arrow Functions; Syntax and Lexical Scoping,http://toddmotto.com/es6-arrow-functions-syntaxes-and-lexical-scoping/
v8worker: Minimal Go Bindings to the V8 JavaScript Engine,https://github.com/ry/v8worker
A Dive Into Brain Bleeding JavaScript Obfuscation,https://blog.korelogic.com/blog/2015/01/12/javascript_deobfuscation
Software Engineer / Entwickler (m/w) eShop – Scala; Scrum; TDD,http://kaufhof-jobs.dvinci.de/cgi-bin/appl/selfservice.pl?action=jobdetail;job_pub_nr=32731CDF-442A-46F0-9C93-75A6C4101B76;p=homepage;preview=1
gundula.pabst@kaufhof.de,mailto:gundula.pabst@kaufhof.de
Web Designer / Interface Developer (m/w) eShop - HTML; AngularJS; JavaScript,http://kaufhof-jobs.dvinci.de/cgi-bin/appl/selfservice.pl?action=jobdetail;job_pub_nr=F903080B-4E8E-4FBF-A284-9D1DDA8EC0DB;p=homepage;preview=1
gundula.pabst@kaufhof.de,mailto:gundula.pabst@kaufhof.de
Ember 2.0 to Retain IE9 Support; Drops IE8,https://github.com/emberjs/rfcs/pull/45?#issuecomment-93009469
JSConf 2015 EU Call for Speakers Open,http://2015.jsconf.eu/call-for-speakers/
Package Manager Npm Raises $8M; Launches Private Modules,http://techcrunch.com/2015/04/14/popular-javascript-package-manager-npm-raises-8m-launches-private-modules/
JS Testing Workshop Online with David Mosher and Justin Searls,https://frontendmasters.com/workshops/javascript-testing/
Get Notified When Your Site is Linked on Hacker News,https://www.twilio.com/blog/2015/04/get-notified-when-someone-posts-an-article-from-your-domain-on-hacker-news-using-node-js-firebase-and-twilio.html
Creating a Next Gen JavaScript App with Aurelia,http://www.sitepoint.com/creating-next-generation-javascript-application-aurelia/
How to Build Your First Angular Project in Visual Studio 2013,http://angularfirst.com/your-first-angular-project-in-visual-studio/
Adding Authentication to A React Flux App,https://auth0.com/blog/2015/04/09/adding-authentication-to-your-react-flux-app/
Rapydscript: A Python-like Pre-Compiler for JavaScript,http://www.rapydscript.com/
Get Your Node.js Application Running in Minutes,http://hubs.ly/y0zSM-0
Understanding the Real Advantages of Using ESLint,http://rangle.io/blog/understanding-the-real-advantages-of-using-eslint/
Oh God; I Built Another JavaScript Framework (But Why?),https://medium.com/on-coding/oh-god-i-built-another-javascript-framework-fb32f0f8ec12
11 Things You Might Not Know About jQuery (Mostly Trivia),http://sixrevisions.com/javascript/things-about-jquery/
layzr.js: Small; Fast; Dependency-free Library for Lazy Loading Images,https://github.com/callmecavs/layzr.js
Harp: The Static Web Server with Built-in Preprocessing,http://harpjs.com/
RQ: A Library for Managing Asychronicity in Server Applications,http://www.rq.crockford.com/
WorkerExchange: A Wrapper for WebWorker and SharedWorker,https://github.com/steelbrain/Worker-Exchange
Dragula: Drag and Drop So Simple It Hurts,https://github.com/bevacqua/dragula
React-Datagrid: A Datagrid for React,http://zippyui.github.io/react-datagrid/
Highland.js: High-Level Streams Library for Node and the Browser,http://highlandjs.org/
jQuery lightSlider: A Responsive Content Slider,http://sachinchoolur.github.io/lightslider/

