title,link
Mulberry: A Development Framework for Native JS and HTML5 Mobile Apps,http://toura.github.com/mulberry/
V8's 1GB Memory Limit (And New Changes to Its GC),http://code.google.com/p/v8/issues/detail?id=847
Firefox 6 No Longer Runs JavaScript URLs in Address Bar in Page's Context,https://bugzilla.mozilla.org/show_bug.cgi?id=656433
The JavaScript Show: A Weekly JavaScript News Podcast,http://javascriptshow.com/
The Best Way to Learn JavaScript (in 9 Assignments),http://net.tutsplus.com/tutorials/javascript-ajax/the-best-way-to-learn-javascript/
Faster JavaScript Memoization For Improved Application Performance,http://addyosmani.com/blog/faster-javascript-memoization/
Useful Node.js Tools; Tutorials And Resources,http://coding.smashingmagazine.com/2011/09/16/useful-node-js-tools-tutorials-and-resources/
Creating Rich Interactive Web Apps with KnockoutJS (Part 1),http://blog.monnet-usa.com/?p=354
Don't Be Stupid When Overriding Backbone.js Methods,http://japhr.blogspot.com/2011/09/dont-be-stupid-when-overring-backbonejs.html
Script Yielding with setImmediate,http://www.nczonline.net/blog/2011/09/19/script-yielding-with-setimmediate/
Building a Node.js Events App Using RabbitMQ; Websockets and Django,http://jamesburkhart.com/building-a-nodejs-events-app-using-rabbitmq-w
How Batman can Help you Build Apps,http://www.shopify.com/technology/4080092-how-batman-can-help-you-build-apps
Essential JavaScript Namespacing Patterns,http://addyosmani.com/blog/essential-js-namespacing/
Box2D & JavaScript Tutorials by Seth Ladd,http://creativejs.com/2011/09/box2d-javascript-tutorial-series-by-seth-ladd/
Visual Demonstrations and Examples of d3.js (Data Driven Documents),http://mbostock.github.com/d3/talk/20110921/#0
Tinkerbin: Another HTML; JavaScript and CSS Sandbox,http://tinkerbin.com/?
,http://tinkerbin.com/?
jQuery PointPoint: A Plugin For Pointing To Things,http://tutorialzine.com/2011/09/jquery-pointpoint-plugin/
rlightbox: A jQuery UI 'Media Lightbox',http://ryrych.github.com/rlightbox2/
SockJS: WebSocket Emulation and Abstraction,http://www.rabbitmq.com/blog/2011/09/13/sockjs-websocket-emulation/
Pagify: jQuery Plugin for Creating Single Page Sites,https://github.com/cmpolis/Pagify
Portamento.js: Easy Sliding/Floating Panels jQuery Plugin,http://simianstudios.com/portamento/
Neon: Another Lightweight Cross-Browser JavaScript Framework,http://neonjs.com/
Gigger; a Realtime Javascript Monitoring Framework,http://blog.mayflower.de/archives/747-Introducing-Gigger,-a-Realtime-Javascript-Monitoring-Framework.html
JavaScript Developer at Ensighten [Cupertino; CA],http://www.ensighten.com/about-us/careers/javascript-developer
,http://www.ensighten.com/about-us/careers/javascript-developer
Why Aren't Circles or Smiley Faces Valid JavaScript Variable Names?,http://stackoverflow.com/q/7451524/3951

