title,link
WebGL Support now in Chrome Beta,http://blog.chromium.org/2010/12/webgl-now-in-beta-here-comes-3d-web.html
New JavaScript Master Class Announced for Jan 2011,http://javascriptmasterclass.com/
Mozilla Vows To Match Google's JavaScript Performance,http://www.theregister.co.uk/2010/12/10/mozilla_on_crankshaft/
Deep Inside Node.js with Ryan Dahl,http://www.infoq.com/interviews/node-ryan-dahl
What to Read to Get Up to Speed in JavaScript,http://blog.reybango.com/2010/12/15/what-to-read-to-get-up-to-speed-in-javascript/
Introducing YUI 3 AutoComplete - A Talk by Ryan Grove,http://www.yuiblog.com/blog/2010/12/10/video-yuiconf2010-grove/
Strict Mode is Coming To Town,http://www.yuiblog.com/blog/2010/12/14/strict-mode-is-coming-to-town/
Real Animation Using JavaScript; CSS3 and HTML 5 Video,http://24ways.org/2010/real-animation-using-javascript-css3-and-html5-video
The Safe Factory Pattern - Private Instance State in JavaScript,http://www.codeproject.com/KB/ajax/SafeFactoryPattern.aspx
JavaScript BDD with Jasmine (without a browser),http://agile.dzone.com/news/javascript-bdd-jasmine-without
ControlJS: ASync Script Loading and More from Steve Souders,http://www.stevesouders.com/blog/2010/12/15/controljs-part-1/
Knox: Amazon S3 Client for Node,https://github.com/learnboost/knox
Easel.JS: JS Library for Working with HTML5 Canvas,http://easeljs.com/

